{
  "id": "us-toakstransit",
  "name": "Thousand Oaks Transit",
  "type": "gtfs",
  "source": {
    "url": "https://data.trilliumtransit.com/gtfs/thousandoaks-ca-us/thousandoaks-ca-us.zip"
  },
  "dataProvider": {
    "name": "Thousand Oaks Transit",
    "url": "https://www.toaks.org/departments/public-works/transit"
  }
}
