{
  "id": "ar-bacolectivos",
  "name": "Colectivos",
  "type": "gtfs",
  "source": {
    "url": "https://apitransporte.buenosaires.gob.ar/colectivos/feed-gtfs",
    "apiInformation": {
      "name": "API Transporte – Datos Abiertos",
      "url": "https://apitransporte.buenosaires.gob.ar/console/"
    },
    "authentication": {
      "type": "query",
      "description": "client_id and client_secret query parameters must be provided."
    }
  },
  "dataProvider": {
    "name": "Gobierno de la Ciudad de Buenos Aires",
    "url": "https://www.buenosaires.gob.ar/"
  },
  "license": {
    "name": "Licence: Creative Commons Atribución 2.5 (Argentina)",
    "url": "https://creativecommons.org/licenses/by/2.5/ar/legalcode"
  },
  "realtime": [ "ar-babusrt" ]
}
