{
  "id": "us-southportlandbus",
  "name": "SouthPortlandBus",
  "type": "gtfs",
  "source": {
    "url": "http://www.smttracker.com/downloads/gtfs/south-portland-me-us.zip"
  },
  "dataProvider": {
    "name": "City of South Portland",
    "url": "https://www.southportland.org/departments/bus-transportation/"
  }
}
